{
  "audit": {
    "responseId": "11111111-1111-4111-8111-111111111104",
    "generatedAt": "2026-05-04T17:00:00Z",
    "engineVersion": "0.4.0",
    "schemaVersion": "0.1.0",
    "vendorSource": {
      "vendor": "Foundation Medicine",
      "product": "FoundationOne Liquid CDx",
      "reportFormat": "pdf",
      "receivedAt": "2026-05-04T16:55:00Z"
    },
    "knowledgeBases": [
      {
        "name": "ClinVar",
        "version": "2026-04-01",
        "refreshedAt": "2026-04-01T00:00:00Z"
      },
      {
        "name": "openFDA",
        "version": "2026-05-01",
        "refreshedAt": "2026-05-01T00:00:00Z"
      }
    ],
    "watermark": "Synthetic data \u2014 demonstration only"
  },
  "specimen": {
    "specimenType": "blood-plasma-cfdna",
    "primaryTumorSite": {
      "icdo3Topography": "C34.9",
      "display": "Lung, NOS"
    },
    "histology": {
      "display": "Lung cancer (NOS)"
    },
    "ctdnaTumorFraction": {
      "value": 0.13,
      "interpretation": "high"
    }
  },
  "variants": [
    {
      "variantId": "22222222-2222-4222-8222-222222222208",
      "gene": {
        "symbol": "ERBB2",
        "hgncId": "HGNC:3430"
      },
      "transcript": "NM_004448.4",
      "hgvsProtein": "p.G776delinsVC",
      "variantType": "indel",
      "molecularConsequence": "inframe_insertion",
      "functionalEffect": "gain-of-function",
      "variantAlleleFraction": 0.09,
      "exon": 20,
      "germlineOrSomatic": "somatic",
      "evidence": {
        "ampAscoCapTier": "I-A"
      }
    },
    {
      "variantId": "22222222-2222-4222-8222-222222222209",
      "gene": {
        "symbol": "TP53",
        "hgncId": "HGNC:11998"
      },
      "transcript": "NM_000546.6",
      "hgvsProtein": "p.R175H",
      "variantType": "snv",
      "molecularConsequence": "missense_variant",
      "functionalEffect": "loss-of-function",
      "variantAlleleFraction": 0.1,
      "germlineOrSomatic": "somatic",
      "clinicalSignificance": "pathogenic",
      "evidence": {
        "ampAscoCapTier": "III"
      }
    }
  ],
  "biomarkers": [
    {
      "biomarkerId": "33333333-3333-4333-8333-333333333307",
      "type": "tmb",
      "loincCode": "94076-7",
      "method": "ngs",
      "value": 6,
      "unit": "mut/Mb",
      "interpretation": "low",
      "threshold": {
        "value": 10,
        "operator": "gte",
        "unit": "mut/Mb"
      }
    },
    {
      "biomarkerId": "33333333-3333-4333-8333-333333333308",
      "type": "msi",
      "loincCode": "81695-9",
      "method": "ngs",
      "interpretation": "stable",
      "value": "MSI-High Not Detected"
    },
    {
      "biomarkerId": "33333333-3333-4333-8333-333333333309",
      "type": "tumor-fraction",
      "method": "ngs",
      "value": 0.13,
      "unit": "fraction",
      "interpretation": "high"
    }
  ],
  "cdxFlags": [
    {
      "cdxFlagId": "44444444-4444-4444-8444-444444444405",
      "triggeredBy": [
        {
          "refType": "variant",
          "refId": "22222222-2222-4222-8222-222222222208"
        }
      ],
      "drug": {
        "name": "trastuzumab deruxtecan",
        "brandName": "Enhertu",
        "rxNormCui": "2362591",
        "atcCode": "L01FD04"
      },
      "indication": {
        "tumorType": "Unresectable or metastatic non-small cell lung cancer with activating HER2 mutations",
        "line": "second-line"
      },
      "approvalRegime": "FDA",
      "approvalDate": "2022-08-11",
      "evidence": {
        "ampAscoCapTier": "I-A"
      },
      "citations": [
        {
          "citation": "FDA accelerated approval for trastuzumab deruxtecan in HER2-mutant NSCLC (DESTINY-Lung02).",
          "url": "https://www.accessdata.fda.gov/drugsatfda_docs/label/2024/761139s032lbl.pdf",
          "knowledgeBase": "openFDA"
        }
      ]
    }
  ],
  "trialMatches": [
    {
      "trialMatchId": "55555555-5555-4555-8555-555555555504",
      "nctId": "NCT05048797",
      "title": "Trastuzumab deruxtecan vs platinum-based chemotherapy in first-line HER2-mutant unresectable, locally advanced or metastatic NSCLC (DESTINY-Lung04)",
      "phase": "phase-3",
      "status": "recruiting",
      "trialDataAsOf": "2026-05-01",
      "matchStrength": "likely-eligible",
      "triggeredBy": [
        {
          "refType": "variant",
          "refId": "22222222-2222-4222-8222-222222222208"
        }
      ],
      "drugs": [
        {
          "name": "trastuzumab deruxtecan"
        }
      ],
      "locations": [
        {
          "country": "US"
        },
        {
          "country": "JP"
        },
        {
          "country": "ES"
        }
      ],
      "url": "https://clinicaltrials.gov/study/NCT05048797"
    }
  ],
  "contraindications": []
}
