{
  "audit": {
    "responseId": "11111111-1111-4111-8111-111111111103",
    "generatedAt": "2026-05-04T16:30:00Z",
    "engineVersion": "0.4.0",
    "schemaVersion": "0.1.0",
    "vendorSource": {
      "vendor": "Foundation Medicine",
      "product": "FoundationOne CDx",
      "reportFormat": "pdf",
      "receivedAt": "2026-05-04T16:25:00Z"
    },
    "knowledgeBases": [
      {
        "name": "ClinicalTrials.gov",
        "version": "2026-05-01",
        "refreshedAt": "2026-05-01T00:00:00Z"
      },
      {
        "name": "openFDA",
        "version": "2026-05-01",
        "refreshedAt": "2026-05-01T00:00:00Z"
      }
    ],
    "watermark": "Synthetic data \u2014 demonstration only"
  },
  "specimen": {
    "specimenType": "ffpe-tumor-tissue",
    "primaryTumorSite": {
      "icdo3Topography": "C34.9",
      "display": "Lung, NOS"
    },
    "histology": {
      "display": "Non-small cell lung carcinoma (NOS)"
    }
  },
  "variants": [
    {
      "variantId": "22222222-2222-4222-8222-222222222207",
      "gene": {
        "symbol": "NTRK1",
        "hgncId": "HGNC:8031"
      },
      "variantType": "fusion",
      "fusionPartner": "TPM3",
      "molecularConsequence": "fusion",
      "functionalEffect": "gain-of-function",
      "germlineOrSomatic": "somatic",
      "evidence": {
        "ampAscoCapTier": "I-A"
      }
    }
  ],
  "biomarkers": [
    {
      "biomarkerId": "33333333-3333-4333-8333-333333333305",
      "type": "tmb",
      "loincCode": "94076-7",
      "method": "ngs",
      "value": 4,
      "unit": "mut/Mb",
      "interpretation": "low"
    },
    {
      "biomarkerId": "33333333-3333-4333-8333-333333333306",
      "type": "msi",
      "loincCode": "81695-9",
      "method": "ngs",
      "interpretation": "stable",
      "value": "MS-Stable"
    }
  ],
  "cdxFlags": [
    {
      "cdxFlagId": "44444444-4444-4444-8444-444444444403",
      "triggeredBy": [
        {
          "refType": "variant",
          "refId": "22222222-2222-4222-8222-222222222207"
        }
      ],
      "drug": {
        "name": "larotrectinib",
        "brandName": "Vitrakvi",
        "rxNormCui": "2105754",
        "atcCode": "L01EX12"
      },
      "indication": {
        "tumorType": "Solid tumors with NTRK gene fusion (tumor-agnostic)",
        "line": "any-line"
      },
      "approvalRegime": "FDA",
      "approvalDate": "2018-11-26",
      "approvedAssay": {
        "vendor": "Foundation Medicine",
        "product": "FoundationOne CDx",
        "fdaApprovalNumber": "P170019"
      },
      "evidence": {
        "ampAscoCapTier": "I-A"
      },
      "citations": [
        {
          "citation": "FDA tumor-agnostic approval for larotrectinib in NTRK-fusion-positive solid tumors.",
          "url": "https://www.accessdata.fda.gov/drugsatfda_docs/label/2024/210861s011lbl.pdf",
          "knowledgeBase": "openFDA"
        }
      ]
    },
    {
      "cdxFlagId": "44444444-4444-4444-8444-444444444404",
      "triggeredBy": [
        {
          "refType": "variant",
          "refId": "22222222-2222-4222-8222-222222222207"
        }
      ],
      "drug": {
        "name": "entrectinib",
        "brandName": "Rozlytrek",
        "rxNormCui": "2197875",
        "atcCode": "L01EX14"
      },
      "indication": {
        "tumorType": "Solid tumors with NTRK gene fusion (tumor-agnostic)",
        "line": "any-line"
      },
      "approvalRegime": "FDA",
      "approvalDate": "2019-08-15",
      "evidence": {
        "ampAscoCapTier": "I-A"
      }
    }
  ],
  "trialMatches": [
    {
      "trialMatchId": "55555555-5555-4555-8555-555555555503",
      "nctId": "NCT02576431",
      "title": "Larotrectinib NAVIGATE (LOXO-TRK-15003): NTRK fusion-positive advanced solid tumors",
      "phase": "phase-2",
      "status": "active-not-recruiting",
      "trialDataAsOf": "2026-05-01",
      "matchStrength": "likely-eligible",
      "triggeredBy": [
        {
          "refType": "variant",
          "refId": "22222222-2222-4222-8222-222222222207"
        }
      ],
      "drugs": [
        {
          "name": "larotrectinib"
        }
      ],
      "locations": [
        {
          "country": "US"
        },
        {
          "country": "FR"
        },
        {
          "country": "DE"
        }
      ],
      "url": "https://clinicaltrials.gov/study/NCT02576431"
    }
  ],
  "contraindications": []
}
