{
  "audit": {
    "responseId": "11111111-1111-4111-8111-111111111107",
    "generatedAt": "2026-05-04T18:30:00Z",
    "engineVersion": "0.4.0",
    "schemaVersion": "0.1.0",
    "vendorSource": {
      "vendor": "Caris Life Sciences",
      "product": "Caris MI Profile",
      "reportFormat": "pdf",
      "receivedAt": "2026-05-04T18:25:00Z"
    },
    "knowledgeBases": [
      {
        "name": "openFDA",
        "version": "2026-05-01",
        "refreshedAt": "2026-05-01T00:00:00Z"
      },
      {
        "name": "ClinicalTrials.gov",
        "version": "2026-05-01",
        "refreshedAt": "2026-05-01T00:00:00Z"
      }
    ],
    "watermark": "Synthetic data \u2014 demonstration only"
  },
  "specimen": {
    "specimenType": "ffpe-tumor-tissue",
    "primaryTumorSite": {
      "icdo3Topography": "C50.4",
      "display": "Upper-outer quadrant of breast"
    },
    "histology": {
      "icdo3Morphology": "8500/3",
      "display": "Invasive mammary carcinoma"
    }
  },
  "variants": [],
  "biomarkers": [
    {
      "biomarkerId": "33333333-3333-4333-8333-333333333315",
      "type": "er",
      "method": "ihc",
      "score": "Negative | 0",
      "interpretation": "negative"
    },
    {
      "biomarkerId": "33333333-3333-4333-8333-333333333316",
      "type": "pr",
      "method": "ihc",
      "score": "Negative | 0",
      "interpretation": "negative"
    },
    {
      "biomarkerId": "33333333-3333-4333-8333-333333333317",
      "type": "her2-ihc",
      "method": "ihc",
      "score": "Negative | 1+, 90%",
      "interpretation": "negative",
      "antibodyClone": "4B5"
    },
    {
      "biomarkerId": "33333333-3333-4333-8333-333333333318",
      "type": "pd-l1",
      "method": "ihc",
      "antibodyClone": "SP142",
      "scoringSystem": "IC",
      "score": "Positive, IC: 1%",
      "value": 1,
      "unit": "%",
      "interpretation": "positive",
      "threshold": {
        "value": 1,
        "operator": "gte",
        "unit": "%"
      }
    },
    {
      "biomarkerId": "33333333-3333-4333-8333-333333333319",
      "type": "ar",
      "method": "ihc",
      "score": "Positive | 3+, 100%",
      "interpretation": "positive"
    }
  ],
  "cdxFlags": [
    {
      "cdxFlagId": "44444444-4444-4444-8444-444444444409",
      "triggeredBy": [
        {
          "refType": "biomarker",
          "refId": "33333333-3333-4333-8333-333333333315"
        },
        {
          "refType": "biomarker",
          "refId": "33333333-3333-4333-8333-333333333316"
        },
        {
          "refType": "biomarker",
          "refId": "33333333-3333-4333-8333-333333333317"
        }
      ],
      "drug": {
        "name": "sacituzumab govitecan",
        "brandName": "Trodelvy",
        "rxNormCui": "2418816",
        "atcCode": "L01FX17"
      },
      "indication": {
        "tumorType": "Metastatic triple-negative breast cancer",
        "line": "second-line"
      },
      "approvalRegime": "FDA",
      "approvalDate": "2021-04-07",
      "evidence": {
        "ampAscoCapTier": "I-A"
      },
      "citations": [
        {
          "citation": "FDA approval for sacituzumab govitecan in metastatic TNBC (ASCENT trial).",
          "url": "https://www.accessdata.fda.gov/drugsatfda_docs/label/2024/761115s029lbl.pdf",
          "knowledgeBase": "openFDA"
        }
      ]
    }
  ],
  "trialMatches": [
    {
      "trialMatchId": "55555555-5555-4555-8555-555555555507",
      "nctId": "NCT02574455",
      "title": "Sacituzumab govitecan in metastatic triple-negative breast cancer (ASCENT)",
      "phase": "phase-3",
      "status": "completed",
      "trialDataAsOf": "2026-05-01",
      "sponsor": "Gilead Sciences",
      "matchStrength": "likely-eligible",
      "triggeredBy": [
        {
          "refType": "biomarker",
          "refId": "33333333-3333-4333-8333-333333333315"
        },
        {
          "refType": "biomarker",
          "refId": "33333333-3333-4333-8333-333333333316"
        },
        {
          "refType": "biomarker",
          "refId": "33333333-3333-4333-8333-333333333317"
        }
      ],
      "drugs": [
        {
          "name": "sacituzumab govitecan"
        }
      ],
      "locations": [
        {
          "country": "US"
        },
        {
          "country": "FR"
        },
        {
          "country": "DE"
        }
      ],
      "url": "https://clinicaltrials.gov/study/NCT02574455"
    }
  ],
  "contraindications": [
    {
      "contraindicationId": "66666666-6666-4666-8666-666666666601",
      "triggeredBy": [
        {
          "refType": "biomarker",
          "refId": "33333333-3333-4333-8333-333333333315"
        },
        {
          "refType": "biomarker",
          "refId": "33333333-3333-4333-8333-333333333316"
        }
      ],
      "drug": {
        "name": "tamoxifen",
        "drugClass": "endocrine therapy"
      },
      "reason": "absence-of-required-biomarker",
      "narrative": "ER and PR are both negative; endocrine therapy is not indicated as the activity is dependent on hormone-receptor positivity."
    },
    {
      "contraindicationId": "66666666-6666-4666-8666-666666666602",
      "triggeredBy": [
        {
          "refType": "biomarker",
          "refId": "33333333-3333-4333-8333-333333333317"
        }
      ],
      "drug": {
        "name": "trastuzumab",
        "drugClass": "anti-HER2 monoclonal antibody"
      },
      "reason": "absence-of-required-biomarker",
      "narrative": "HER2 IHC is negative (1+); HER2-targeted therapy is not indicated by current FDA labeling for HER2-low TNBC except for trastuzumab deruxtecan in HER2-low (IHC 1+ or 2+/ISH-) settings, evaluated separately."
    }
  ]
}
